title,link,description,bloggername,bloggerlink,postdate
이세영 숏자켓 SOUP 숲 숏 <b>트렌치코트</b> 숲몰 할인,https://blog.naver.com/invu1657/223772538495,클래식한 트렌치 디자인에 세련된 디테일을 더해 캐주얼하면서도 키가 작아도 부담없이 입을 수 있는 것이 특징이에요. 숲 #숏<b>트렌치코트</b> 는 면과 나일론 혼방 소재로 약간의 조직감이 느껴지는데 뻣뻣하지... ,낭만소녀의 워너비걸즈,blog.naver.com/invu1657,20250225
<b>트렌치코트</b> 사이로 보이는 네이비 셋업의 힙한 반전 패션,https://blog.naver.com/jju6004/224179816023,"겉으로 보기엔 우아하고 클래식한 <b>트렌치코트</b>를 걸쳤지만 그 사이로 보이는 스포티한 네이비... 좋고, 코튼과 레이온 혼방 소재로 제작되어 가볍고 편안하게 착용하기 좋아요. 탈착 가능한 벨트를... ",완벽한 당신을 위하여,blog.naver.com/jju6004,20260211
"56세 김혜수, 시크한 미모 눈길 시크한 <b>트렌치코트</b> 스타일까지",https://blog.naver.com/ghtjd1647/224173938006,"&quot;뱀파이어설&quot; 56세 김혜수, 시크한 미모 눈길 시크한 <b>트렌치코트</b> 스타일까지 단발 헤어 + 또렷한 옆선... 시크한 <b>트렌치코트</b> 사복, 역시 김혜수 스타일 사복 패션도 역시 기대를 저버리지 않았어요. 베이지 톤의... ",HoHo's fashion,blog.naver.com/ghtjd1647,20260206
&quot;이 코트 어디 거?&quot; 솔비가 선택한 120만원대 MMAM <b>트렌치코트</b>... ,https://blog.naver.com/under123123/224075605269,어깨에서 자연스럽게 떨어지는 케이프 디테일은 클래식한 <b>트렌치코트</b>에 드라마틱한 무드를 더해줍니다. 솔비 님은 이 롱코트를 다른 아이템 없이 원피스처럼 단독으로 착용하여 코트 본연의 디자인을... ,일상최적화,blog.naver.com/under123123,20251115
남자 <b>트렌치코트</b> 데이트룩! 클래식함에 캐주얼을 더하다,https://blog.naver.com/hl-henry/224070964216,"클래식함 속에 캐주얼을 더한 데이트룩으로 <b>트렌치코트</b> 어떠세요?! 목차 1. 가을 하면 떠오르는 대표 아우터는? 2. 클래식하지만 캐주얼하게! 3. <b>트렌치코트</b>, 니트와 치노팬츠와 함께 4. 꾸민 듯 안 꾸민 부담... ",Henry's Business Casual,blog.naver.com/hl-henry,20251110
&quot; 현실감 없는 뒤태에 난리난 55세 여배우 여자 <b>트렌치코트</b>... ,https://blog.naver.com/goodlucky1215/224164731015,"여자 <b>트렌치코트</b>를 입고, 캐주얼한 분위기의 코디를 선보였어요. 코트 안에는 그래픽 티셔츠와 블랙... 그리고 레드 볼캡, 볼드한 체인 목걸이, 스니커즈를 더해 자칫 무거워질 수 있는 여자 오버핏 트렌치... ",패션니 쪠님의 일상,blog.naver.com/goodlucky1215,20260130
코트 입어도 황금비율! 효민 <b>트렌치코트</b> 스타일 애슬레저룩,https://blog.naver.com/syous0/224181388686,"봄가을 환절기 시즌에 입기 좋은 <b>트렌치코트</b>를 200% 활용하고 있는데요, 효민의 코트 정보를 간략하게 요약해 드리면 레하(LEHA) 메이플 <b>트렌치코트</b> 공식 가격 : 598,000원 소재 : 코튼, 레이온 어깨 장식 (견장)... ",빈티지 네이션,blog.naver.com/syous0,20260212
기은세 <b>트렌치코트</b> 코디로 미리 준비하는 가을의 시작,https://blog.naver.com/mythya0730/223990484278,"그런 그녀가 최근 피드에 여러 장의 사진을 올렸는데 가을 코디를 고민하시는 분들에게 좋은 영감을 줄 것 같습니다 EENK Oversized Long Peacoat Beige (998,000원) <b>트렌치코트</b>가 아닌 피코트라고 되어 있지만, 무릎... ",블루,blog.naver.com/mythya0730,20250901
캐주얼 여성 <b>트렌치 코트</b> 스트링 여자 <b>트렌치 코트</b> 리뷰,https://blog.naver.com/freelife247/224177053880,#여성<b>트렌치코트</b> #스트링트렌치 #캐주얼트렌치 #가성비코트 #간절기아우터 #봄가을코트 #데일리코트 #여자아우터추천 #체형보정코트 #출근룩아우터 #꾸안꾸룩 #<b>트렌치코트</b>추천 #여성캐주얼룩 #데일리룩... ,에듀빅뱅,blog.naver.com/freelife247,20260209
기본 여자 <b>트렌치 코트</b> 데님 여성 가을 코트 간절기,https://blog.naver.com/freelife247/224177058200,"기본 여자 <b>트렌치 코트</b> 데님 여성 가을 코트 간절기는 그런 조건을 충족하는 실속형 아이템으로, 실제 착용 후 데일리 활용도가 높게 느껴졌습니다. 기본 디자인이 주는 안정감 군더더기 없는 기본 트렌치... ",에듀빅뱅,blog.naver.com/freelife247,20260209
<b>트렌치코트</b> 하나로 가을 분위기 찍먹하는 백지헌 공항패션,https://blog.naver.com/syous0/224052453390,"전체적으로 움직이기 편한 옷차림에 <b>트렌치코트</b>를 매치하여 가을 분위기를 살짝 가미한 실속형 코트 룩인데요, 요즘 Z세대 감성에 걸맞은 편안함을 우선시한 효율적인 가을 아우터 활용법의 표본이라고 할 수... ",빈티지 네이션,blog.naver.com/syous0,20251024
"자라 세일 중 구경, <b>트렌치 코트</b>, 숏코트, 하프코트, 봄코트... ",https://blog.naver.com/leh5965/224123740040,ㅋㅋ 그치만 잘 입으면 너무 예쁜 아이템들 정말 많더라고요. 쇼핑하러~ 자라 세일할 때 방문해 보세요 : ) #자라세일 #자라부츠 #자라코트 #자라무스탕 #자라자켓 #자라<b>트렌치코트</b> #자라데님자켓,소피아의 하루,blog.naver.com/leh5965,20251226
"브레스티드 외투 모음zip (자켓, 싱글<b>트렌치코트</b>, 겨울코트)",https://blog.naver.com/teddyjieun/224059536284,"싱글<b>트렌치코트</b> 가을이면 절대 빼놓을 수 없는 아이템이에요 싱글<b>트렌치코트</b>는 더블 트렌치보다 훨씬... 싱글<b>트렌치코트</b>는 코튼, 나일론 등 소재에 따라 분위기가 달라요 스카프나 머플러로 액센트를 주면... ",디트리의 패션을 가지고 놀다,blog.naver.com/teddyjieun,20251031
10만원대 김선호 '이사랑통역이되나요' <b>트렌치코트</b>,https://blog.naver.com/cocoleenice/224169027700,"배우 김선호님의 요즘 젤 핫한 드라마 '이사랑통역이되나요'에서 코디해 난리난 <b>트렌치코트</b> 지오송지오 &quot;레이어드 트렌치 브라운&quot;의 가격은 발매가격 620,000원 현재 할인중으로 할인가격 186,010원... ",매거진파리,blog.naver.com/cocoleenice,20260202
니트·스커트·<b>트렌치 코트</b>부터 가방 키링 추천까지 여자 옷... ,https://blog.naver.com/99551414/224158963372,봄에 빼놓을 수 없는 데님 아이템과 <b>트렌치 코트</b>도 함께 출시되었는데요. 중성적인 실루엣의 <b>트렌치 코트</b>에 세련된 스커트를 매치한 룩 역시 감각적인 분위기가 돋보이는 것 같아요. 봄 출근룩이나... ,Alice in Wonderland,blog.naver.com/99551414,20260126
기은세 간절기 코디 아우터 <b>트렌치코트</b> 스타일 어디꺼?,https://blog.naver.com/jetchoi/223993052195,"가을은 길지 않지만, <b>트렌치코트</b>의 존재감은 늘 선명하죠. 무심한 듯 툭 걸쳐도 멋스럽고 때론... 트렌치 느낌의 아우터는 미니멀한 피 코트로 제품명은 [ Oversized Long Peacoat ] 오버사이즈의 롱한 기장으로 각... ",❤️슈이니뷰티❤️,blog.naver.com/jetchoi,20250903
래트 <b>트렌치코트</b> 여성 고급의류 가을 코디 추천,https://blog.naver.com/s_rosa/223982848343,"가격: 220,000원 사이즈 free(55~77) 컬러 차콜 소재 코튼72,나일론28%(안감없음 신축성없음) 후드 탈착... 드라이클리닝 #여성가을코디 #여성가을트렌치 #여성<b>트렌치코트</b> #가을<b>트렌치코트</b> #여성고급의류쇼핑몰",로사부띠끄,blog.naver.com/s_rosa,20250825
폴뉴아 가을컬렉션 하이넥 <b>트렌치코트</b> &amp; 리조백으로 가을 준비,https://blog.naver.com/babybe_/224027679103,하이넥 <b>트렌치코트</b> &amp; 리조백으로 가을 준비 폴뉴아 가을 컬렉션 가을이 되면 가장 먼저 손이 가는 아이템은 단연 <b>트렌치코트</b>와 가방이잖아요? 발빠르게 폴뉴아의 25FW 가을 컬렉션의 두 가지 아이템을 직접... ,매 순간을 소중히.,blog.naver.com/babybe_,20250930
‘3대째 손이 가는’ 정은채 <b>트렌치코트</b> 코디,https://blog.naver.com/gguu1029/224016167616,티브이데일리 정은채는 가을을 대표하는 패션 아이템 <b>트렌치코트</b>와 터틀넥 니트를 매치하고 블랙... 베이지 코트 안에 블랙 컬러의 니트를 매치해 깔끔하면서도 세련된 대비를 완성해 주었는데요. 누구나 많이... ,걸스픽,blog.naver.com/gguu1029,20250921
버버리 <b>트렌치코트</b> 오버핏까지 | 여성 인기 코트 정리,https://blog.naver.com/rayharp/223826125585,이런 분께 추천 가볍고 실루엣이 자연스러운 데일리 <b>트렌치코트</b>를 찾는 분 주의점 라이닝이 없는 구조라 한겨울에는 단독 착용이 어려워요 간절기부터 초겨울까지 버버리 트렌치 하나면 충분해요! 버버리 코트... ,쭌이덕 블로그,blog.naver.com/rayharp,20250408
"기은세 현실핏 가을룩, 더운데 <b>트렌치코트</b> 언제?",https://blog.naver.com/sunnyya314/223988874542,얼마전 sns에 <b>트렌치코트</b> 착용샷을 올린 기은세 님 역시 &quot;가을을 기다리는 자세 땀이나도 굴하지 않기&quot; 라는 코멘트를 달기도 했어요. 역시 가을이 되면 가장 먼저 떠오르는 아이템이 바로 <b>트렌치코트</b>죠. 단... ,뷰티소싱,blog.naver.com/sunnyya314,20250830
다 이루어질지니 수지 옷 | 수지 코트 | 수지 <b>트렌치 코트</b> | 착장... ,https://blog.naver.com/nepesh_yunnie/224073463919,심플한 골드 주얼리와 매치해서 트렌치의 장점을 더 부각시켜주고있었다. <b>트렌치 코트</b> 기본으로 잘... #다이루어질지니 #다이루어질지니수지패션 #다이루어질지니수지옷 #<b>트렌치코트</b> #코트,네페쉬의 반짝임 기록,blog.naver.com/nepesh_yunnie,20251112
닥스 남성 클래식 <b>트렌치코트</b> 베이지,https://blog.naver.com/egu6606/224175913887,스마트스토어 바로가기 https://smartstore.naver.com/onemoreplz/  자사몰 바로가기 https://vintageandnew.kr #빈티지앤뉴 #닥스 #닥스<b>트렌치코트</b> #남성<b>트렌치코트</b> #클래식코트 #베이지트렌치 #출근룩코트 #남성아우터... ,VINTAGE AND NEW,blog.naver.com/egu6606,20260208
블루트 남자 롱 더블 오버핏 <b>트렌치코트</b> 봄 가을 리뷰,https://blog.naver.com/freelife247/224177004447,#블루트 #남자<b>트렌치코트</b> #롱<b>트렌치코트</b> #오버핏코트 #봄코트 #가을코트 #남자아우터 #데일리코트 #출근룩 #남친룩 #코트추천 #가성비코트 #환절기아우터 #남자패션 #봄가을코트,에듀빅뱅,blog.naver.com/freelife247,20260209
이렇게 입으면 무조건 성공! 정채연 <b>트렌치코트</b> 어그 행사 코디,https://blog.naver.com/gguu1029/224060889956,바로 정채연의 <b>트렌치코트</b> 스타일링인데요. 정채연 인스타그램 정채연은 최근 어그 X 사카이... 니트 + 스커트를 매치하고 <b>트렌치코트</b>를 착용해 주며 클래식 + 러블리한 스타일링을 완성해 주었답니다. 정채연... ,걸스픽,blog.naver.com/gguu1029,20251101
가을 아우터 디자이너브랜드 르니나 여자 싱글 <b>트렌치코트</b> 코디,https://blog.naver.com/south0429/224007334163,싱글<b>트렌치코트</b>는 고밀도 코튼 100% 원단을 사용해 입자마자 오~ 좋다~ 라는 생각이 들더라고요 봄 가을... 싱글<b>트렌치코트</b> #여자<b>트렌치코트</b> #여자<b>트렌치코트</b>코디 #디자이너브랜드 #르니나 #르니나트렌치... ,남쪽구슬,blog.naver.com/south0429,20250914
올가을 교복처럼 입게 될 <b>트렌치코트</b> 코디 5가지,https://blog.naver.com/a_ololo/224021034877,"벨트리스 미니멀 트렌치 벨트가 없는 심플한 디자인의 <b>트렌치코트</b>는 오픈 코트처럼 툭 걸쳐 입기 좋다. 기본 티셔츠와 슬랙스를 매치하면 출근길 오피스룩으로, 니트 톱과 데님 팬츠 조합으로는 주말... ",이응이 스타일 ️,blog.naver.com/a_ololo,20250925
"10월 오늘날씨 기온별옷차림 8도, 10도, 12도 (<b>트렌치코트</b>... ",https://blog.naver.com/qmfosej/224048056780,"스타킹 ●10~11°C: <b>트렌치코트</b>, 간절기 야상, 여러 겹 껴입기 ●6~9°C: 코트, 가죽자켓, 니트 레이어드... 베이지 트렌치는 부드럽고 클래식한 무드라 데님 팬츠랑 입어도 예쁘고 플라워 원피스랑 코디에도 넘... ",뷰티 데일리 @이람님,blog.naver.com/qmfosej,20251021
이사랑통역되나요 김선호 옷 주호진 자켓 <b>트렌치 코트</b> 점퍼... ,https://blog.naver.com/hsh6566/224149431761,이사랑통역되나요 주호진 코트 브랜드는 에피그램(EPIGRAM) 벨티드 코트 ERCAM23111KHX 입니다. ▶지오송지오 <b>트렌치코트</b>◀ ✔ 레이어드 디테일이 돋보이는 세미 오버핏 트렌치 클래식한 트렌치 디자인에 반더블... ,세상만물상,blog.naver.com/hsh6566,20260118
나이가 믿기지 않는 패션센스 김혜수 <b>트렌치코트</b> 코디 근황,https://blog.naver.com/gguu1029/224077728210,롱 <b>트렌치코트</b>에 와이드 데님 팬츠를 매치한 모습이었는데요. 꾸안꾸 분위기와 고급스러움을 완벽하게... <b>트렌치코트</b>와 레드 색상의 볼캡을 매치해 힘을 뺀 듯한 세련된 분위기를 연출한다던가 어글리슈즈를... ,걸스픽,blog.naver.com/gguu1029,20251116
2025 봄 아우터는 '<b>트렌치코트</b>'! 크롭 <b>트렌치코트</b> 코디 모음,https://blog.naver.com/pd2da/223814908056,다음 스트릿 룩을 통해 요즘 트렌치 스타일을 참고해 보세요. <b>트렌치코트</b> + 미니스커트 크롭 <b>트렌치코트</b> 스타일링 팁 크롭 <b>트렌치코트</b>는 짧은 미니스커트와 매치하면 다리가 길어 보이는 효과를 얻을 수 있어요!... ,친절한 수경씨,blog.naver.com/pd2da,20250330
파라컴 여성 루즈핏 싱글버튼 카라넥 중장 <b>트렌치 코트</b>,https://blog.naver.com/freelife247/224180481242,#파라컴 #여성<b>트렌치코트</b> #루즈핏코트 #싱글버튼코트 #카라넥코트 #중장코트 #간절기아우터 #여성아우터추천 #데일리코디 #출퇴근룩 #하객룩코디 #가성비코트 #네이버쇼핑 #브랜드커넥트 #여성패션추천,에듀빅뱅,blog.naver.com/freelife247,20260211
"<b>트렌치코트</b>, 올가을 코디 꾸리는 방법 3가지",https://blog.naver.com/sunnyya314/224002139048,"김나영 블랙 미니멀&amp;트렌치의 시크 매치 블랙 원피스 + <b>트렌치코트</b>, 슬림한 선글라스, 날렵한 슈즈 블랙 톤으로 전체를 단정히 잡고, 베이지 트렌치로 포인트를 준 스타일. 코트 안쪽 체크 라이닝까지 은근하게... ",뷰티소싱,blog.naver.com/sunnyya314,20250910
여자 간절기 숏 <b>트렌치코트</b> 코디 추천,https://blog.naver.com/with_vanilla_/224051430558,숏 <b>트렌치코트</b> 코디 보여드릴게요 : ) 아우터 : 165스튜디오 상의 : 시티브리즈 바지 : 보세 신발 : 디올 가방 : 셀린느 165스튜디오라는 쇼핑몰에서 작년에 숏 트렌치를 구입했었는데 재질도 좋고 숏 기장을... ,바닐라 일상이야기,blog.naver.com/with_vanilla_,20251023
여성 크롭 숏 <b>트렌치 코트</b> 코디,https://blog.naver.com/aobo7/223805459550,"클래식한 디자인에 탄탄한 소재감, 숏트렌치 #여성코트 #숏코트 #숏트랜치코트 #여성<b>트렌치코트</b> | 편안한 데일리 이지룩, 여성의류쇼핑몰 코발트론 cobaltlawn 안녕하세요. 코발트론입니다. 벌써 봄이 훌쩍... ",LOOKEUN & ARCHIVE,blog.naver.com/aobo7,20250322
로엠 숏 <b>트렌치 코트</b> RMJTF23R11 리뷰,https://blog.naver.com/freelife247/224177009637,클래식한 트렌치 디테일은 살리면서도 전체적인 분위기는 가볍고 산뜻해 봄·가을 데일리 아우터로... 데일리코트 #출근룩코트 #여성아우터추천 #간절기코트 #가성비코트 #<b>트렌치코트</b>추천 #여자봄코트,에듀빅뱅,blog.naver.com/freelife247,20260209
"유난히 짧은 가을, <b>트렌치코트</b>... 가을 <b>트렌치코트</b> 코디 모음✨",https://blog.naver.com/margot1031/224048649448,"유난히 짧을 것 같은 이번 가을, 가을을 제대로 즐기기 위한 필수템 <b>트렌치코트</b>  매년 찾아오는 트렌치의 계절, 하지만 올해는 유난히 짧을 것 같은 가을이라 더 특별하게 느껴지는데요, 오늘은 그런 가을을... ",마고의 패션뷰티,blog.naver.com/margot1031,20251021
숏<b>트렌치 코트</b> 코디 베이지 블랙,https://blog.naver.com/aobo7/223640351619,"활용도 높은 데일리룩 아이템 오버핏 숏<b>트렌치 코트</b>, 여성 가을 숏<b>트렌치 코트</b> #블랙<b>트렌치코트</b> #베이지트렌치 간절기 필수 아이템인 숏<b>트렌치 코트</b>를 소개해 드릴게요. 이번 봄부터 가을까지 반응 좋은... ",LOOKEUN & ARCHIVE,blog.naver.com/aobo7,20241030
데일리한 가을 코트 <b>트렌치코트</b> 코디 5가지♥,https://blog.naver.com/purplemodern/224012859169,중에서 &quot;<b>트렌치코트</b>&quot;가 생각난다는! 꼭 트렌치 스타일이 아니더라도 롱한 길이감의 가을 코트는 참 분위기가 있는 것 같아요 그래서 오늘 포스팅 주제로 &quot;가을 코트 코디&quot;를 준비해 보았답니다... ,리아의 감성다락,blog.naver.com/purplemodern,20250919
가을 유행 컬러 &amp; 패션 트렌드 ( 그레이 스웨이드 <b>트렌치코트</b>... ,https://blog.naver.com/elleest486/224035052147,이상 가을 유행 컬러 패션 트렌드 그레이 스웨이드 <b>트렌치코트</b> 코디입니다. #가을유행컬러 #가을패션트렌드 #그레이<b>트렌치코트</b>코디 #스웨이드<b>트렌치코트</b>코디 #<b>트렌치코트</b>코디 #가을트렌지코트코디,Hello! Lovely!,blog.naver.com/elleest486,20251008
2025 가을 여자 <b>트렌치코트</b> 코디 (싱글 vs 더블),https://blog.naver.com/elleest486/223997865423,멋진 <b>트렌치코트</b> 코디를 완성할 수 있을까요? 그 첫 번째 싱글 <b>트렌치코트</b> 코디 입니다. 싱글 트렌치는... 여자<b>트렌치코트</b>코디 #가을트렌지코트 #가을<b>트렌치코트</b>코디 #2025<b>트렌치코트</b> #2025여자<b>트렌치코트</b>코디,Hello! Lovely!,blog.naver.com/elleest486,20250906
하프 <b>트렌치코트</b> 크롭 숏 <b>트렌치 코트</b> 코디,https://blog.naver.com/aobo7/224044428324,블랙 크롭티셔츠+블랙코튼진에 진베이지 하프<b>트렌치코트</b> 더해주니 대비되면서 깔끔한 느낌! 숏한 기장감 덕분에 다리가 길어 보이고 크롭한 트렌치 특유의 실루엣이 전체적으로 비율을 예쁘게... ,LOOKEUN & ARCHIVE,blog.naver.com/aobo7,20251017
꾸안꾸 예쁜 여성 롱 <b>트렌치코트</b> 코디 &amp; 이너 스타일링 Tip,https://blog.naver.com/elleest486/224042431598,여성 롱<b>트렌치코트</b>는 코트를 착용하기에는 두텁고 얇은 바람막이를 입기에는 서늘할 때 입기 좋은 최적화된 꾸안꾸 가을 아우터로 2025 올가을에도 머스트 해브 아이템입니다. 그렇지만 여성 <b>트렌치코트</b>는... ,Hello! Lovely!,blog.naver.com/elleest486,20251015
가을 <b>트렌치코트</b> 코디 핀터레스트 가을코디,https://blog.naver.com/i486usaprice/224067817821,"<b>트렌치코트</b> 하면 카멜, 탄, 베이지 컬러 등 기본적인 톤의 컬러를 선호하고 있는데 그 외 카키, 그레이, 화이트 등 다양한 컬러의 트렌치도 스타일리시하니 훨씬 세련돼 보이는 것 같아요 다양한 <b>트렌치코트</b>... ",Inspired by ME :D,blog.naver.com/i486usaprice,20251107
"(핀터레스트 출근룩) 역대급 예쁜 기은세 <b>트렌치코트</b> 코디,,",https://blog.naver.com/gguu1029/224062013813,"보테가베네타 보테가베네타 코튼 <b>트렌치코트</b> (5,820,000원) 기은세가 착용한 <b>트렌치코트</b>는 보테가베네타 제품이에요. 공홈에는 아직 베이지 컬러는 보이지 않았는데요. 탈착 가능한 인트레치아토 가죽 카라를... ",걸스픽,blog.naver.com/gguu1029,20251102
