title,link,description,bloggername,bloggerlink,postdate
미군 1946패턴 OD7 필드 오버코트(<b>트렌치 코트</b>),https://blog.naver.com/rasmrasm/224048114391,때문에 1942년 말에는 장교용에 한정되었지만 코튼덕 재질 투피스 <b>트렌치 코트</b>가 우선 도입되기도 했습니다. 사병용 <b>트렌치 코트</b>의 경우는 모직 원단의 재고 부족이 전쟁 중반부터는 해소된데다 오히려 코튼... ,군장블로그,blog.naver.com/rasmrasm,20251021
버버리 <b>트렌치코트</b> 추천! 직구로 저렴히 구매하는 방법,https://blog.naver.com/yochiiiii/224069862048,"버버리 <b>트렌치코트</b> 추천 글이 많이 보이더라고요~! 하지만 아무래도 가격적인 면 때문에 구매가... 많은 트렌치 원피스에요~ 코트를 귀엽고 여성스럽게 재해석한 라인이라, 부츠나 스틸레토에 매치하면... ",블리콩,blog.naver.com/yochiiiii,20251109
버버리<b>트렌치코트</b> 명품세탁 전문점  가정에서 절대 부분 작업... ,https://blog.naver.com/pks1389/224174398511,"오늘은 버버리<b>트렌치코트</b> 세탁외 관리 방법에 대하여 자세히 알려 드리겠습니다. 먼저 버버리<b>트렌치코트</b> 면 원단의 버버리 <b>트렌치코트</b> 제발 부분 작업 하지 마세요. 퐁퐁, 세제로 부분 작업하면 무조건 트러블... ",35년 경력 특 급 호 텔 출신 명품세탁 전문점,blog.naver.com/pks1389,20260209
이영애 보테가베네타 바바라 토트백 <b>트렌치코트</b> 멋져,https://blog.naver.com/kesook02/224170219806,실루엣의 <b>트렌치코트</b> 역시 시선을 사로잡아 새롭게 변신한 젠더리스한 매력을 제대로 찢었다라고... 발견한 <b>트렌치코트</b> 또한 그냥 넘어갈 수가 없어 찾아봤지만 아직 공식 홈페이지 업데이트 전이라 브랜드 SNS... ,리즈덤 룩&록,blog.naver.com/kesook02,20260203
"방문기, 송혜교 착용 자켓 셋업 <b>트렌치코트</b> 직접 입어봤어요",https://blog.naver.com/babybe_/224166247462,"MICHAA 미샤 미샤 신세계 사우스시티 리뉴얼 방문기 송혜교 착용 자켓 · 셋업 · <b>트렌치코트</b> 직접... 미샤 26 SS 컬렉션 이번 미샤 봄 신상에서 특히 눈에 띄었던 건 자켓, 셋업, <b>트렌치코트</b>처럼 미샤가 가장... ",매 순간을 소중히.,blog.naver.com/babybe_,20260131
"자라 봄 신상 후기, 이번 봄 신상 미쳤다~<b>트렌치코트</b>·니트... ",https://blog.naver.com/ssr327/224173097933,"자라 봄 신상 트렌치, 이 가격에 이 퀄리티 실화? NEW 리버서블 체크 <b>트렌치코트</b> ZW 컬렉션 가격: 189,900원 처음 봤을 때 가장 먼저 든 생각은 “이 디자인, 버버리 카 코트 느낌인데?”였어요. 전체적인 실루엣과... ",레몬버베나의 건강한 일상,blog.naver.com/ssr327,20260205
26SS 트렌드 CJ온스타일 르네디피 <b>트렌치코트</b>와 함께하는... ,https://blog.naver.com/sooooong2/224179288054,하프 트렌치 일교차가 큰 봄 날씨에 클래식한 <b>트렌치코트</b> 하나쯤은 필수인데 르네디피에서도 봄자켓으로 특별한 트렌치가 출시되었다 :-) 화보컷 보면서도 계속해서 눈길이 갔었는데 기존에 흔하게 볼 수 있던... ,songsong.yi,blog.naver.com/sooooong2,20260210
"박지현 겨울 사복 베트멍 푸퍼 <b>트렌치코트</b>, 600만원대 입는... ",https://blog.naver.com/under123123/224102052095,"즉, 빵빵한 패딩(푸퍼)과 클래식한 <b>트렌치코트</b>가 하나로 합쳐진 형태예요. 솔직히 겨울에 얼어 죽어도 코트(얼죽코)파와 생존형 패딩파가 갈리잖아요? 이건 그 두 가지 니즈를 한 방에 해결해 주는... ",일상최적화,blog.naver.com/under123123,20251211
<b>트렌치코트</b> (빈티지 버버리 <b>트렌치코트</b>),https://blog.naver.com/come_home/224055146286,"이번에 구입한 버버리 빈티지 <b>트렌치코트</b>. 맥코트 스타일의 싱글버튼이긴 하지만, 어깨, 길이감이 딱 맘에 들어 한참 고민하다 구입했다. (<b>트렌치 코트</b>가 많은 편이기도 하고, 약간 짝퉁같은 느낌도 살짝 있어서..... ",come_home,blog.naver.com/come_home,20251027
"버버리 Burberry 퀼팅 자켓, <b>트렌치코트</b>, 스카프 등 세타이어... ",https://blog.naver.com/bluebirdkids/224059466006,"현재 세타이어에서 버버리 Burberry 퀼팅 자켓, <b>트렌치 코트</b>, 스카프 등이 세일에 들어갔습니다. 지금 시즌에 입기 좋은 코트부터 스카프까지 다양하게 올라와 있습니다. 공홈 가격이랑 비교해 보면... ",파랑새블로그,blog.naver.com/bluebirdkids,20251031
"데일리룩 봄자켓, <b>트렌치코트</b> 살펴본다면 CJ온스타일 르네디피",https://blog.naver.com/meesoda/224178870555,"벤베르그 큐프라 하프 트렌치 딱딱하고 무거운 <b>트렌치코트</b>가 부담스러웠다면 하프 기장이라 키에 구애받지 않고, 툭 걸쳐도 자연스럽게 우아한 아우라가 살아나는 봄자켓 타입 거기에 무게감이 크게 없는... ",겔뱅의 라이프스타일,blog.naver.com/meesoda,20260210
니트 패션 자라에서 찾아보기 ft. <b>트렌치코트</b> 봄버자켓 볼링백,https://blog.naver.com/hanuri37/224175113155,"ㅋㅋ ZW 컬렉션 LIMITED EDITION 배색 칼라 후드 <b>트렌치 코트</b> 189,900원 3811/041/407 출처 자라 케이프코트를 좋아하는 1인인데 트렌치에 케이프처럼 명품느낌 물씬 풍겨 입어본 배색칼라 후드 <b>트렌치코트</b>는 안감의... ",Hachi's fashion fur blog,blog.naver.com/hanuri37,20260207
유니클로 르메르맛 <b>트렌치코트</b> 오픈칼라쇼트재킷 피팅 후기,https://blog.naver.com/rlathdus88kr/224179183838,신상 피팅은 언제나 즐겁다 오늘은 <b>트렌치코트</b>를 건져 기쁜 마음이에요 곧 출시되는 JW앤더슨 피팅으로 돌아올게요! #유니클로신상 #봄트렌치 #봄<b>트렌치코트</b> #<b>트렌치코트</b>여자 #여자<b>트렌치코트</b> #봄코디 #봄아우터,쥴리의 경험 쌓기,blog.naver.com/rlathdus88kr,20260210
김나영 버버리 <b>트렌치코트</b> 캐시미어 머플러 가을룩 (제품정보... ,https://blog.naver.com/luvddang9/224058209432,"돋보이는 <b>트렌치 코트</b>. 버버리의 시그니처 체크무늬 면 안감이 클래식함을 더해주는. 블랙 이너와 뮬로... 사실 이 버버리 캐시미어 머플러는 트렌치 뿐만 아니라 한겨울 캐주얼 패딩, 코트 모두 진짜 두루두루... ",에이미의 아름다운 날들,blog.naver.com/luvddang9,20251029
북극성 전지현 <b>트렌치코트</b>,https://blog.naver.com/jayuyu/223964446543,전지현님 <b>트렌치코트</b>를 궁금해 하시는 분들이 가장 많았습니다. 이미지 출처 - symbol 북극성 전지현 <b>트렌치코트</b> 브랜드 - khaite 제품명 - Beige double-breasted trench coat 가격 - 300만원대 이미지 출처... ,제인 블로그,blog.naver.com/jayuyu,20250809
미샤 송혜교 자켓 <b>트렌치코트</b> 실제 핏은? 신세계 사우스시티점... ,https://blog.naver.com/lovenada6/224166914466,미샤 <b>트렌치코트</b>예요. 전형적인 트렌치보다 디테일이 훨씬 절제돼 있어서 부담 없이 손이 가는 스타일이었어요. 시즌마다 꺼내 입을 수 있는 클래식 디자인인데요. 벨트를 자연스레 묶어서 허리선을... ,콩님로그,blog.naver.com/lovenada6,20260131
애슬레저 셋업 + <b>트렌치코트</b> 믹스매치로 공항간 효민,https://blog.naver.com/flexgoo/224180626583,애슬레저 셋업 + <b>트렌치코트</b> 믹스매치로 공항간 효민 아니 이런 스타일 조합으로도 공항을 갈수... 베이지컬러의 <b>트렌치코트</b>를 믹스매치한 공항룩을 연출해주었습니다. 여기에 레터링이 자수된... ,일본구짱,blog.naver.com/flexgoo,20260211
"뉴이어 컬렉션 봄니트, <b>트렌치코트</b>, 스커트, 가방 키링 추천",https://blog.naver.com/minju1004b/224155857874,"브랜드에서도 <b>트렌치 코트</b>, 봄 니트, 가방 키링 같은 다양한 추천 뉴이어 컬렉션을 선보이고 있는데... 니트나 <b>트렌치코트</b>를 걸치셔도 좋고 오늘 소개해 드리는 &amp; Other Stories 안에서 찾으셔서 걸치셔도... ",패션 인플루언서 복숭아링,blog.naver.com/minju1004b,20260123
#레오파드무늬롱<b>트렌치코트</b> #호피패딩롱코트,https://blog.naver.com/stylishellya/224161664663,행사복 #파티룩 #간지룩 #데일리룩 #세미정장룩 #럭셔리룩 #stylishellya #여성토탈패션 #섹시스타일룩 #동안룩 #엘랴 #나들이룩 #데이트룩 #데이트패션룩 #호피쟈갸드롱코트 #호피<b>트렌치코트</b>,stylishellya 엘랴님의 블로그,blog.naver.com/stylishellya,20260127
남자 싱글 <b>트렌치코트</b> 코디 오버핏 사이즈 미니멀한 디자인,https://blog.naver.com/coolps8/224060103712,남자 싱글 <b>트렌치코트</b> 코디 오버핏 사이즈 미니멀한 디자인 안녕하세요 패션 인플루언서 마성훈입니다.... 오늘은 미니멀한 디자인과 오버핏 사이즈가 마음에 들었던 남자 싱글 <b>트렌치코트</b> 코디 아이템으로... ,마성훈의 패션 블로그,blog.naver.com/coolps8,20251031
자라 프리미엄 울블렌드 아이보리 숏 <b>트렌치코트</b>,https://blog.naver.com/cjclub9/224113730844,"트렌치 디테일: 어깨 견장, 소매 스트랩, 앞면의 건 플랩(Gun Flap) 등 클래식한 <b>트렌치코트</b>의 요소를... 사이즈 선택 가이드 자라의 프리미엄 라인 숏 코트는 대개 여유 있는 오버사이즈 핏으로 나옵니다.... ",LP◎스탁,blog.naver.com/cjclub9,20251218
"2026년 봄 아우터 패션 | 봄자켓, 수트, <b>트렌치코트</b>",https://blog.naver.com/go_travel_go/224180228411,#요즘유행하는옷 #봄아우터추천 #봄옷추천 #봄패션 #2026패션트렌드 #2026년자켓 #2026년<b>트렌치코트</b> #봄코디추천 #코트 #여성코트 #2026년유행코트 #2026년봄패션,ɪɴ the FLOW,blog.naver.com/go_travel_go,20260211
메키즈데플레어 공홈 직구 풀레브 <b>트렌치코트</b> 사이즈 120,https://blog.naver.com/71lepnzh33/224014263059,너무 금방지나가서 메키즈데플레어 <b>트렌치코트</b> 부지런히 입혀볼게요 :) 엔젤코트는 조금 더 쌀쌀해지면 후기 남겨볼게요 :) TIP 공홈 한국어 변경 개인통관번호 정확한 영문 주소 배대지 필요없음 사이즈... ,잇끌리다 육아＊여행＊일상,blog.naver.com/71lepnzh33,20250923
"켄달 제너의 미리보는 <b>트렌치코트</b> 스타일링, 더 로우 가방... ",https://blog.naver.com/gangan_go/224175875937,따뜻한 LA에 사는 걸 켄달 제너는 <b>트렌치코트</b>에 실크스카프를 두르고 쇼핑 나왔습니다 안 추운 게 제일... 싱글버튼 <b>트렌치코트</b>는 더 로우 신상입니다 크림색 데님진도 더 로우 이러다 양말도 더 로우 신겠다 가죽... ,closet the closet,blog.naver.com/gangan_go,20260208
"김고은 <b>트렌치코트</b>, 샤넬 머플러로 완성한 사복 코디",https://blog.naver.com/lovemeskf/224160944278,김고은 <b>트렌치코트</b>는 샤넬 chanel 2026 봄-여름 프리-컬렉션 <b>트렌치 코트</b> 개버딘 베이지 1300만원이에요.... 블랙 컬러에 로고 디테일이 더해져 코트의 트리밍과 자연스럽게 연결되면서 룩에 통일감을 주고 있어요.... ,THE FASHION HOOK,blog.naver.com/lovemeskf,20260127
아르켓 <b>트렌치코트</b> xxs 후기 더현대 아르켓 추천리스트,https://blog.naver.com/pistachio820/224064451532,생일선물로 현대백화점 상품권 10만원이 생겨 뭘 살까 고민하던중 <b>트렌치코트</b>를 발견! 어머! 이건 사야해~~~ 트렌치가 아주 탄탄한 재질이예요. 멋스럽고 카라는 골덴이고 너무 맘에 드는데 문제는 가격이로다.... ,해변의 파프리카,blog.naver.com/pistachio820,20251104
<b>트렌치코트</b>를 세탁기에 돌리면 어떻게 될까?,https://blog.naver.com/twink_sweet/224061896789,다 지워지진않았는데 그래도 흐려져서 이제 남들이 푸디씨 등에 뭐 묻었어 는 안할듯 ㅋㅋ 결론: 앞으로도 트렌치 세탁기에 물세탁 하겠습니다 그럼 이만... <b>트렌치코트</b> 다림질 하러 가보께요,The Foodie's Diary,blog.naver.com/twink_sweet,20251102
"&quot;파리 패션의 정석&quot; 김고은, 샤넬 <b>트렌치코트</b>룩",https://blog.naver.com/bllong2/224171911709,"파리에서 포착된 샤넬 <b>트렌치코트</b>룩.. 클래식이 이렇게 세련될 수 있다니! 김고은, 샤넬 트렌치룩... 코트는 여유 있는 A라인인데, 안에는 블랙 터틀넥을 레이어드했더라구요. 겉은 볼륨감 있게, 안은... ",꽃블롱,blog.naver.com/bllong2,20260204
명품의류세탁 버버리<b>트렌치코트</b> 얼룩제거 특수세탁 황변제거... ,https://blog.naver.com/pks1389/224095774706,오늘은 버버리<b>트렌치코트</b> 특수세탁과 특수오염제거 사례 올려 드립니다. 첫번째로 버버리<b>트렌치코트</b> 오랜기간 보관만 하여 전체적으로 황변 현상이 생겨 일산동구에서 카톡 상담후에 택배로 보내주신... ,35년 경력 특 급 호 텔 출신 명품세탁 전문점,blog.naver.com/pks1389,20251204
마시모두띠 <b>트렌치코트</b> 사이즈 &amp; 할인 정보(30대 남자 옷 추천),https://blog.naver.com/dlwlqk/224180992759,깔끔하면서 소재까지 좋은 30대 남자 <b>트렌치코트</b>로 마시모두띠 라이트 코튼 <b>트렌치코트</b> 뽑아보았는데요 어떤 제품인지 아래에서 함께 보실까요? 제품 상세 컷 오늘 리뷰하는 마시모두띠 라이트 코튼... ,행복한세상의댕댕이씨,blog.naver.com/dlwlqk,20260212
폴뉴아 안네 <b>트렌치코트</b> 여자 코디 추천,https://blog.naver.com/serrri/223787000431,쌀쌀해지긴 했지만 그래도 조만간 겨울 아우터를 벗어던지고 예쁜 봄 코트를 입을 날이 얼마 남지 않은 것 같아요 저는 이번에 봄 아우터 쇼핑을 할 때 꼭 사고 싶었던 게 여자 <b>트렌치코트</b>였어요 여러 디자이너... ,콩토루네,blog.naver.com/serrri,20250307
"정소민이 착용한 구스다운 여자 롱 패딩 <b>트렌치 코트</b>, 겨울... ",https://blog.naver.com/under123123/224087342654,"겨울에도 따뜻함은 기본이고, <b>코트</b> 특유의 우아한 라인까지 놓치고 싶지 않은 분들에게는 이만한 선택지가 없을 것 같아요. 온앤온 <b>트렌치</b> 롱 구스 다운 (NEP5XHB11_93) 정가: 539,000원 올겨울, 패딩 유목민 생활... ",일상최적화,blog.naver.com/under123123,20251128
"르니나 LENINA 선공개 2026 SPRING 컬렉션 봄 <b>트렌치코트</b>, 새틴... ",https://blog.naver.com/redbrickcottages/224180650703,봄 <b>트렌치코트</b> 신제품까지 너무 설레는 옷들이 가득가득했습니다 ㅎㅎ 르니나 2026 SPRING 컬렉션... 봄 <b>트렌치코트</b> 코디! 이거는.. 진짜 단연 입어봐야 하는 봄 아우터이구요. 제가 또 <b>트렌치코트</b> 킬러잖아요... ,kimgume,blog.naver.com/redbrickcottages,20260211
전지현 자라 <b>트렌치코트</b>,https://blog.naver.com/jayuyu/224034001951,"이미지 출처 - 디즈니플러스 but, 7회 속에서 엄청난 분량을 자랑했던 롱한 길이감의 <b>트렌치코트</b>는 놀랍고 반갑게도(?) 자라 제품! 한창 유행했던 워크 자켓의 <b>트렌치코트</b> 버전으로 캐주얼한 분위기가... ",제인 블로그,blog.naver.com/jayuyu,20251007
숲 SOUP 여자 <b>트렌치코트</b> 이세영 봄 코디 손민수,https://blog.naver.com/kmgun0304/223766429550,"하객룩, 데이트룩, 출근룩까지 올킬하는 만능 여자 <b>트렌치코트</b>라 한 번 사면 두고두고 잘 입을 듯! 간절기 코트 괜찮은 거 찾고 있었다면 이거 강추 ~ 현재 자사몰에서 다양한 혜택도 적용가능하니 알뜰하게... ",멕이의 블로그,blog.naver.com/kmgun0304,20250219
"버버리 부터  더로우, 바버, 망고, 띠어리 <b>트렌치코트</b> 직구하기",https://blog.naver.com/mallteriyang/223768638364,"봄을 기다리는 마음으로 살랑이는 바람 속에서도 봄의 기운이 스며드는 요즘, 꽃샘추위마저 설레게 만드는 <b>트렌치코트</b>의 계절이 돌아왔어요. 클래식하면서도 세련된 <b>트렌치코트</b>는 봄에 빠질 수 없는... ",몰테일 블로그,blog.naver.com/mallteriyang,20250221
가을 <b>트렌치코트</b> 코디. 인사일런스 오버사이즈 <b>트렌치코트</b>... ,https://blog.naver.com/alsyd84/224062324651,닥터마틴 첼시부츠가 트렌치의 이미지와 맞는 슬림하고 샤프한 셰입을 연출하기 때문이죠. 등짝의... 아예 짧게 입는 피코트나 숏코트 계열이라면 모를까 <b>트렌치코트</b>의 기장감은 롱코트와 거의 동일하게... ,천재 족제비 김밍스의 집사 블로그,blog.naver.com/alsyd84,20251102
롱코트 우먼즈 캐시미어 블렌드 <b>트렌치 코트</b> 토프 S사이즈 후기,https://blog.naver.com/jina0079/224136536738,실용성이 돋보이는 디자인 디테일 무신사스탠다드 코트는 클래식한 <b>트렌치 코트</b>의 요소를 실용적으로 잘 녹여낸 점이 인상적이었습니다. 활동성 있는 뒤판 턱: 뒤판에는 턱(Tuck) 디테일이 들어가 있습니다. 이... ,DORI BUBU,blog.naver.com/jina0079,20260106
"(판매) 미군 USMC <b>트렌치코트</b>, 바바리.",https://blog.naver.com/nife7108/224129582974,이 <b>트렌치코트</b>는 미 해병대(USMC) 보급용 올 웨더 코트입니다. 이 코트는 군납품이며 민간 브랜드 제품과 유사한 클래식한 디자인이 특징입니다. 색상: 일반적으로 퓨터 그레이(Pewter Gray) 또는 탄(Tan... ,蒼空을 날다,blog.naver.com/nife7108,20251231
*마감* RebeccaMinkoff * 레베카 밍코프 퀼트 <b>트렌치 코트</b>... ,https://blog.naver.com/myshop0070/224097663181,"도시적인 <b>트렌치</b> 자켓디쟌이라 오픈해서 <b>코트</b>로, 허리묶고 시크하게 두가지 컬러로 코리댁이 핫딜가 준비했소요. 100% 폴리 (퀼트) 블랙 * 카키 XS (44) S (55) M (66) L(77) XL (88) 정사이즈로 하심 딱 이뻐요.... ",보스톤코리댁 by 코샵(Coryshop),blog.naver.com/myshop0070,20251204
남자 <b>트렌치코트</b> 코디 가을 데일리룩 패션 필수 아이템,https://blog.naver.com/coolps8/224038696112,"탄탄하고 균형이 잘 잡힌 원단 남자 <b>트렌치코트</b> 코디 상품의 옷의 소재도 저는 개인적으로 마음에 들었습니다. 사용한 소재는 코튼, 나일론, 폴리에스터 혼방이며 코튼 소재로만 사용하지 않았기에 주름의... ",마성훈의 패션 블로그,blog.naver.com/coolps8,20251012
2026SS 컬렉션 공개 남자 여자 봄 <b>트렌치 코트</b> 자켓 코디,https://blog.naver.com/aapron/224165564451,"여성 컬렉션 먼저 여성 컬렉션 먼저 구경해볼게요~ 봄하면 <b>트렌치코트</b>죠! 코트 게일-SU(GAEL-SU)은 고급스러운 스웨이드 소재로 제작되었고, 허리벨트로 여성스러운 무드를 풍기는 아이템이에요~ 맥카지만의... ",톡톡튀는 스타일,blog.naver.com/aapron,20260130
올봄 유행 예감? 켄달 제너가 <b>트렌치코트</b>를 입는 방법,https://blog.naver.com/keita_hitomi/224178933076,나도 벨트 없이 나온 자라 코트에 버버리 <b>트렌치코트</b>에 달린 끈 벨트를 이용해 코디를 한 적이 있거든. 같은 코트도 벨트를 하는 거랑 안 했을 때랑 느낌이 전혀 다르더라고! 근데 켄달 제너처럼... ,彼女のドレスルーム(나오클로젯),blog.naver.com/keita_hitomi,20260210
김나영 패션 속 버버리 <b>트렌치코트</b> 가을 프렌치시크룩 정석이야,https://blog.naver.com/yuccana/224037735812,롱 개버딘 엘링엄 핏 앤 플레어 카 코트 (베이지) 1920년대 <b>트렌치코트</b> 안감에서 시작한 버버리 체크는 지금은 브랜드의 아이덴티티라 해도 과언이 아닌데요. 롱 개버딘 엘링엄 핏 앤 플레어 카 코트 (퀼 베이지)... ,"유까 패션,뷰티,핫플 블로그",blog.naver.com/yuccana,20251011
"H&amp;M 에이치앤엠 매장서 가을 아우터 <b>트렌치 코트</b>, 자켓 리뷰✨",https://blog.naver.com/myojinx/224031097273,"오늘은 어머니와 함께 롯데몰에 들렸다가 <b>트렌치코트</b>, 자켓 등 착용해본 솔직 리뷰 남겨보려고 합니다... <b>트렌치코트</b> 가격: 119,000원 가을 하면 <b>트렌치코트</b>지 않나요? H&amp;M에 다양한 종류로 출시되었던데 그중에... ",MYO SPACE,blog.naver.com/myojinx,20251003
"&quot;역대급 비주얼&quot; 난리 난 수지, 화제의 뮤비 속 '그 <b>트렌치코트</b>... ",https://blog.naver.com/under123123/224069885787,"셀린느 윌턴 <b>트렌치코트</b> (Wiltern Trench Coat) 수지가 착용한 메인 아이템은 셀린느의 '윌턴 <b>트렌치코트</b>'입니다. 클래식의 정수라 불리는 더블 브레스티드 디자인에, 견고함이 느껴지는 코튼 개버딘 소재가... ",일상최적화,blog.naver.com/under123123,20251110
인천에서  버버리<b>트렌치코트</b> 크리닝 기름오염제거 명품세탁... ,https://blog.naver.com/pks1389/224075026692,오늘은 인천 강화군에서 우체국 택배로 보내주신 버버리 <b>트렌치코트</b> 바람막이 원단 기름이 포함된 음식물 오염제거 접수건 입니다. 버버리 <b>트렌치코트</b>에 기름오염은 어떤 기름인가에 따라 제거 여부가... ,35년 경력 특 급 호 텔 출신 명품세탁 전문점,blog.naver.com/pks1389,20251113
당일배송우리집 1회 김성령 옷 <b>트렌치 코트</b> 자켓 플리스... ,https://blog.naver.com/jhgs1701/224112292434,[ 다양한 아이템 더 알아보기 ] #당일배송우리집 #당일배송우리집1회 #김성령패션 #김성령자켓 #김성령<b>트렌치코트</b> #골든구스코트 #크리스털트렌치 #세릭 #CERRIC #스트라이프티셔츠 #카라티 #핀치탑 #프리터... ,잇템힛템,blog.naver.com/jhgs1701,20251216
경도를기다리며 9회 원지안 옷 데님 원피스 <b>트렌치 코트</b> 자켓... ,https://blog.naver.com/lzheng/224133866148,원지안 <b>트렌치 코트</b> 자켓 L'agence Kento 크롭 트렌치 자켓 클래식한 <b>트렌치코트</b>의 디테일을 고스란히... ✔ 탄탄한 코튼 소재와 여유로운 실루엣 100% 면 소재로 제작되어 형태가 흐트러지지 않고 탄탄하게 잡히는... ,스탠딩굿즈,blog.naver.com/lzheng,20260104
베이직의 정석 A.P.C 아페쎄 더블 브레스티드 여성 <b>트렌치 코트</b>,https://blog.naver.com/egu6606/224181144051,스마트스토어 바로가기 https://smartstore.naver.com/onemoreplz/  자사몰 바로가기 https://vintageandnew.kr #빈티지앤뉴 #APC #아페쎄 #<b>트렌치코트</b> #여성트렌치 #더블트렌치 #명품아우터 #여성코트 #봄코트 #가을코트... ,VINTAGE AND NEW,blog.naver.com/egu6606,20260212
클래식하게 매년 입기 좋은 봄 싱글 롱 맥시 <b>트렌치</b> 바바리 <b>코트</b>,https://blog.naver.com/yahm1208/224177125277,싱글코트에 탄탄한 소재감이라 한해 입고마는 그런 옷이 아니고 여러해 착용할 수 있는 트렌치예요... 캐주얼한 코트로 모던한 <b>트렌치 코트</b>의 느낌을 잘 살려주어 군더더기 없이 코디하기 좋아요 ♥ 일교차가... ,jsoo,blog.naver.com/yahm1208,20260209
올 가을 <b>트렌치코트</b>를 입는다면?,https://blog.naver.com/trendora_79/223988026551,"사람이 생기있어 보이기 때문에 칙칙하고 흐린 비오는 날 이런 색감의 <b>트렌치코트</b>를 입는다면 기분 전환이 될 것이다. 나는 참고로 기본 베이지 숏 버젼(레인코트 재질의 후드달린 카키베이지 자켓), 오버핏 롱... ",dora_79님의 블로그,blog.naver.com/trendora_79,20250829
자라 2026년 zw 컬렉션 <b>트렌치코트</b> 신상 리뷰,https://blog.naver.com/perfect1726/224179947343,더 많은 <b>트렌치코트</b>가 나올거라고 예상하기 때문에 좀 더 지켜봐야겠어요! #자라<b>트렌치코트</b> #자라봄신상 #자라<b>트렌치코트</b>여성 #자라<b>트렌치코트</b>사이즈 #자라봄자켓 #자라코트여성 #자라신상 #자라신상아우터,워너비베짱이,blog.naver.com/perfect1726,20260211
[예약 판매 상품] Mila Owen 오버사이즈 <b>트렌치코트</b>,https://blog.naver.com/junghae3144/223997640200,쓴 <b>트렌치코트</b>. 대충 입는 것만으로 멋지게 보이는 것은 롱기장&amp;오버사이즈 디자인이 트렌드를 따르고 있기 때문입니다. 트렌치다운 본격적인 디테일을 남기면서도 포인트를 더하고 빼 더욱 세련된... ,maison de roro,blog.naver.com/junghae3144,20250906
"이주미 기은세 PICK,여성 패딩 추천! 온앤온 <b>트렌치코트</b> 롱패딩",https://blog.naver.com/ooeoroom/224054464715,온앤온 <b>트렌치코트</b> 패딩 다음 주 부터 점점 추워진다는 소식에 미리미리 롱패딩 준비해볼게요 온앤온 (~37% 할인) &gt;&gt; 제품 보러가기 사실 작년에 제가 팔로우하는 이주미 인스타그램에서 이 트렌치 롱패딩 코트를... ,PEEK A BOO,blog.naver.com/ooeoroom,20251026
